{
  "$schema": "https://github.com/HenryLau1103/AUB/schema/lock.schema.json",
  "version": "0.3.0",
  "source_file": "examples/dashboard.ui.json",
  "exported_at": "2026-06-09T18:51:23.892Z",
  "source_editor_version": "0.3.0",
  "hashes": {
    "blueprint": "sha256:dc62ea076ec5c44990981e9edab8947cdd56ff9f94651ac8a93ee0b8a850abfa",
    "node_ids": "sha256:39fc092940c0113ac5e45418a477572648fbcb86548d968a498594b959de78dd",
    "layout": "sha256:1ce1269ad6ceb6e7e0445b7bb4db4aadad8404017f7444a9d2a4aa050d13502a",
    "design_system": "sha256:d631865bb83cd8bf0fb7ed333821a7f5efaa8980708a12ffa11bef27eab551d2",
    "component_tree": "sha256:fe2d14a85c6cb74354f35e1a88b95c0546addc911c034698b6b3fb995d253a79",
    "interactions": "sha256:de0c09c40f8126c85fd1af0049a772f9f2fb63cda0afd7e032158b8634a67d75",
    "acceptance": "sha256:6e09bb63542cb3243a734289a0ba913af4107fdfcec4a1ba46c0620aa9d5c46b"
  },
  "counts": {
    "nodes": 24,
    "interactions": 6,
    "responsive": 5,
    "acceptance": 11
  }
}
